,Contents.,Subpart 501A.,Introduction.501.00,Introduction.Overview of water erosion .................................................................501-1,501-1.
0,,Subpart 501B,Water Erosion,Water Erosion,501-1
1,,,501.10,Forms of water erosion ......................................................................501-1,
2,,,501.11,The water erosion process .................................................................501-1,
3,,Subpart 501C,Estimating sheet and rill erosion,Estimating sheet and rill erosion,501-2
4,,,501.20,"How, why, and by whom water erosion is estimated .....................501-2",
5,,,501.21,Methods of estimating sheet and rill erosion ..................................501-2,
6,,,501.22,The Revised Universal Soil Loss Equation version 2 (RUSLE2)....501-3,
7,,,501.23,Limitations of the equation ................................................................501-3,
8,,,501.25,Data needed to support RUSLE2 ......................................................501-4,
9,,,501.26,Tools for using RUSLE2 .....................................................................501-4,
10,,Subpart 501D,Principles of water erosion control,Principles of water erosion control,501-4
11,,,501.30,Overview of principles ........................................................................501-4,
12,,,501.31,Relation of soil loss values to RUSLE2 factors ...............................501-4,
13,,Subpart 501E,References,References,501-5
